17:44:12.455944 IP6 2001:638:709:a::1 > 2001:638:709:b::1: frag (1448|50)
17:44:13.483881 IP6 2001:638:709:a::1 > 2001:638:709:b::1: frag (0|1352) ICMP6, echo request, seq 2, length 1352
17:44:13.483905 IP6 2001:638:709:a::1 > 2001:638:709:b::1: frag (1352|146)
17:44:14.507702 IP6 2001:638:709:a::1 > 2001:638:709:b::1: frag (0|1352) ICMP6, echo request, seq 3, length 1352
17:44:14.507725 IP6 2001:638:709:a::1 > 2001:638:709:b::1: frag (1352|146)
17:44:15.531184 IP6 2001:638:709:a::1 > 2001:638:709:b::1: frag (0|1352) ICMP6, echo request, seq 4, length 1352
17:44:15.531209 IP6 2001:638:709:a::1 > 2001:638:709:b::1: frag (1352|146)
17:44:16.555224 IP6 2001:638:709:a::1 > 2001:638:709:b::1: frag (0|1352) ICMP6, echo request, seq 5, length 1352
17:44:16.555248 IP6 2001:638:709:a::1 > 2001:638:709:b::1: frag (1352|146)
17:44:17.580116 IP6 2001:638:709:a::1 > 2001:638:709:b::1: frag (0|1352) ICMP6, echo request, seq 6, length 1352
17:44:17.580143 IP6 2001:638:709:a::1 > 2001:638:709:b::1: frag (1352|146)
17:44:18.603026 IP6 2001:638:709:a::1 > 2001:638:709:b::1: frag (0|1352) ICMP6, echo request, seq 7, length 1352
17:44:18.603049 IP6 2001:638:709:a::1 > 2001:638:709:b::1: frag (1352|146)
17:44:19.627861 IP6 2001:638:709:a::1 > 2001:638:709:b::1: frag (0|1352) ICMP6, echo request, seq 8, length 1352
17:44:19.627886 IP6 2001:638:709:a::1 > 2001:638:709:b::1: frag (1352|146)
17:44:20.651205 IP6 2001:638:709:a::1 > 2001:638:709:b::1: frag (0|1352) ICMP6, echo request, seq 9, length 1352
17:44:20.651229 IP6 2001:638:709:a::1 > 2001:638:709:b::1: frag (1352|146)
17:44:21.675549 IP6 2001:638:709:a::1 > 2001:638:709:b::1: frag (0|1352) ICMP6, echo request, seq 10, length 1352
17:44:21.675584 IP6 2001:638:709:a::1 > 2001:638:709:b::1: frag (1352|146)
17:44:22.699472 IP6 2001:638:709:a::1 > 2001:638:709:b::1: frag (0|1352) ICMP6, echo request, seq 11, length 1352
17:44:22.699496 IP6 2001:638:709:a::1 > 2001:638:709:b::1: frag (1352|146)
17:44:23.723393 IP6 2001:638:709:a::1 > 2001:638:709:b::1: frag (0|1352) ICMP6, echo request, seq 12, length 1352
17:44:23.723486 IP6 2001:638:709:a::1 > 2001:638:709:b::1: frag (1352|146)
17:44:24.747140 IP6 2001:638:709:a::1 > 2001:638:709:b::1: frag (0|1352) ICMP6, echo request, seq 13, length 1352
17:44:24.747164 IP6 2001:638:709:a::1 > 2001:638:709:b::1: frag (1352|146)
17:44:25.771030 IP6 2001:638:709:a::1 > 2001:638:709:b::1: frag (0|1352) ICMP6, echo request, seq 14, length 1352
17:44:25.771054 IP6 2001:638:709:a::1 > 2001:638:709:b::1: frag (1352|146)
17:44:26.795854 IP6 2001:638:709:a::1 > 2001:638:709:b::1: frag (0|1352) ICMP6, echo request, seq 15, length 1352
17:44:26.795879 IP6 2001:638:709:a::1 > 2001:638:709:b::1: frag (1352|146)
17:44:27.819231 IP6 2001:638:709:a::1 > 2001:638:709:b::1: frag (0|1352) ICMP6, echo request, seq 16, length 1352
17:44:27.819254 IP6 2001:638:709:a::1 > 2001:638:709:b::1: frag (1352|146)
17:44:28.843209 IP6 2001:638:709:a::1 > 2001:638:709:b::1: frag (0|1352) ICMP6, echo request, seq 17, length 1352
17:44:28.843232 IP6 2001:638:709:a::1 > 2001:638:709:b::1: frag (1352|146)
17:44:29.867803 IP6 2001:638:709:a::1 > 2001:638:709:b::1: frag (0|1352) ICMP6, echo request, seq 18, length 1352
17:44:29.867826 IP6 2001:638:709:a::1 > 2001:638:709:b::1: frag (1352|146)
17:44:30.891165 IP6 2001:638:709:a::1 > 2001:638:709:b::1: frag (0|1352) ICMP6, echo request, seq 19, length 1352
17:44:30.891187 IP6 2001:638:709:a::1 > 2001:638:709:b::1: frag (1352|146)
17:44:31.915747 IP6 2001:638:709:a::1 > 2001:638:709:b::1: frag (0|1352) ICMP6, echo request, seq 20, length 1352
17:44:31.915773 IP6 2001:638:709:a::1 > 2001:638:709:b::1: frag (1352|146)
17:44:32.939744 IP6 2001:638:709:a::1 > 2001:638:709:b::1: frag (0|1352) ICMP6, echo request, seq 21, length 1352
17:44:32.939767 IP6 2001:638:709:a::1 > 2001:638:709:b::1: frag (1352|146)
17:44:33.963209 IP6 2001:638:709:a::1 > 2001:638:709:b::1: frag (0|1352) ICMP6, echo request, seq 22, length 1352
17:44:33.963231 IP6 2001:638:709:a::1 > 2001:638:709:b::1: frag (1352|146)
17:44:34.987177 IP6 2001:638:709:a::1 > 2001:638:709:b::1: frag (0|1352) ICMP6, echo request, seq 23, length 1352
17:44:34.987199 IP6 2001:638:709:a::1 > 2001:638:709:b::1: frag (1352|146)
17:44:36.011046 IP6 2001:638:709:a::1 > 2001:638:709:b::1: frag (0|1352) ICMP6, echo request, seq 24, length 1352
17:44:36.011069 IP6 2001:638:709:a::1 > 2001:638:709:b::1: frag (1352|146)
17:44:37.035530 IP6 2001:638:709:a::1 > 2001:638:709:b::1: frag (0|1352) ICMP6, echo request, seq 25, length 1352
17:44:37.035550 IP6 2001:638:709:a::1 > 2001:638:709:b::1: frag (1352|146)
17:44:38.059195 IP6 2001:638:709:a::1 > 2001:638:709:b::1: frag (0|1352) ICMP6, echo request, seq 26, length 1352
17:44:38.059218 IP6 2001:638:709:a::1 > 2001:638:709:b::1: frag (1352|146)
17:44:39.083060 IP6 2001:638:709:a::1 > 2001:638:709:b::1: frag (0|1352) ICMP6, echo request, seq 27, length 1352
17:44:39.083084 IP6 2001:638:709:a::1 > 2001:638:709:b::1: frag (1352|146)
17:44:40.107281 IP6 2001:638:709:a::1 > 2001:638:709:b::1: frag (0|1352) ICMP6, echo request, seq 28, length 1352
17:44:40.107305 IP6 2001:638:709:a::1 > 2001:638:709:b::1: frag (1352|146)
17:44:41.131641 IP6 2001:638:709:a::1 > 2001:638:709:b::1: frag (0|1352) ICMP6, echo request, seq 29, length 1352
17:44:41.131666 IP6 2001:638:709:a::1 > 2001:638:709:b::1: frag (1352|146)
17:44:42.155572 IP6 2001:638:709:a::1 > 2001:638:709:b::1: frag (0|1352) ICMP6, echo request, seq 30, length 1352
17:44:42.155596 IP6 2001:638:709:a::1 > 2001:638:709:b::1: frag (1352|146)
17:44:43.179025 IP6 2001:638:709:a::1 > 2001:638:709:b::1: frag (0|1352) ICMP6, echo request, seq 31, length 1352
17:44:43.179050 IP6 2001:638:709:a::1 > 2001:638:709:b::1: frag (1352|146)
17:44:44.203698 IP6 2001:638:709:a::1 > 2001:638:709:b::1: frag (0|1352) ICMP6, echo request, seq 32, length 1352
17:44:44.203723 IP6 2001:638:709:a::1 > 2001:638:709:b::1: frag (1352|146)
17:44:45.227473 IP6 2001:638:709:a::1 > 2001:638:709:b::1: frag (0|1352) ICMP6, echo request, seq 33, length 1352
17:44:45.227695 IP6 2001:638:709:a::1 > 2001:638:709:b::1: frag (1352|146)
17:44:46.251976 IP6 2001:638:709:a::1 > 2001:638:709:b::1: frag (0|1352) ICMP6, echo request, seq 34, length 1352
17:44:46.251999 IP6 2001:638:709:a::1 > 2001:638:709:b::1: frag (1352|146)
17:44:47.275212 IP6 2001:638:709:a::1 > 2001:638:709:b::1: frag (0|1352) ICMP6, echo request, seq 35, length 1352
17:44:47.275236 IP6 2001:638:709:a::1 > 2001:638:709:b::1: frag (1352|146)
17:44:48.299699 IP6 2001:638:709:a::1 > 2001:638:709:b::1: frag (0|1352) ICMP6, echo request, seq 36, length 1352
17:44:48.299731 IP6 2001:638:709:a::1 > 2001:638:709:b::1: frag (1352|146)
17:44:49.323146 IP6 2001:638:709:a::1 > 2001:638:709:b::1: frag (0|1352) ICMP6, echo request, seq 37, length 1352
17:44:49.323172 IP6 2001:638:709:a::1 > 2001:638:709:b::1: frag (1352|146)
17:44:50.348013 IP6 2001:638:709:a::1 > 2001:638:709:b::1: frag (0|1352) ICMP6, echo request, seq 38, length 1352
17:44:50.348032 IP6 2001:638:709:a::1 > 2001:638:709:b::1: frag (1352|146)
17:44:51.371300 IP6 2001:638:709:a::1 > 2001:638:709:b::1: frag (0|1352) ICMP6, echo request, seq 39, length 1352
17:44:51.371325 IP6 2001:638:709:a::1 > 2001:638:709:b::1: frag (1352|146)
17:44:52.395085 IP6 2001:638:709:a::1 > 2001:638:709:b::1: frag (0|1352) ICMP6, echo request, seq 40, length 1352
17:44:52.395105 IP6 2001:638:709:a::1 > 2001:638:709:b::1: frag (1352|146)
17:44:53.419136 IP6 2001:638:709:a::1 > 2001:638:709:b::1: frag (0|1352) ICMP6, echo request, seq 41, length 1352
17:44:53.419159 IP6 2001:638:709:a::1 > 2001:638:709:b::1: frag (1352|146)
17:44:54.444057 IP6 2001:638:709:a::1 > 2001:638:709:b::1: frag (0|1352) ICMP6, echo request, seq 42, length 1352
17:44:54.444111 IP6 2001:638:709:a::1 > 2001:638:709:b::1: frag (1352|146)
17:44:55.467460 IP6 2001:638:709:a::1 > 2001:638:709:b::1: frag (0|1352) ICMP6, echo request, seq 43, length 1352
17:44:55.467484 IP6 2001:638:709:a::1 > 2001:638:709:b::1: frag (1352|146)
17:44:56.491101 IP6 2001:638:709:a::1 > 2001:638:709:b::1: frag (0|1352) ICMP6, echo request, seq 44, length 1352
17:44:56.491119 IP6 2001:638:709:a::1 > 2001:638:709:b::1: frag (1352|146)
17:44:57.515092 IP6 2001:638:709:a::1 > 2001:638:709:b::1: frag (0|1352) ICMP6, echo request, seq 45, length 1352
17:44:57.515113 IP6 2001:638:709:a::1 > 2001:638:709:b::1: frag (1352|146)
17:44:58.539542 IP6 2001:638:709:a::1 > 2001:638:709:b::1: frag (0|1352) ICMP6, echo request, seq 46, length 1352
17:44:58.539565 IP6 2001:638:709:a::1 > 2001:638:709:b::1: frag (1352|146)
17:44:59.563954 IP6 2001:638:709:a::1 > 2001:638:709:b::1: frag (0|1352) ICMP6, echo request, seq 47, length 1352
17:44:59.563983 IP6 2001:638:709:a::1 > 2001:638:709:b::1: frag (1352|146)
17:45:00.587155 IP6 2001:638:709:a::1 > 2001:638:709:b::1: frag (0|1352) ICMP6, echo request, seq 48, length 1352
17:45:00.587179 IP6 2001:638:709:a::1 > 2001:638:709:b::1: frag (1352|146)
17:45:01.611069 IP6 2001:638:709:a::1 > 2001:638:709:b::1: frag (0|1352) ICMP6, echo request, seq 49, length 1352
17:45:01.611092 IP6 2001:638:709:a::1 > 2001:638:709:b::1: frag (1352|146)
17:45:02.635023 IP6 2001:638:709:a::1 > 2001:638:709:b::1: frag (0|1352) ICMP6, echo request, seq 50, length 1352
17:45:02.635044 IP6 2001:638:709:a::1 > 2001:638:709:b::1: frag (1352|146)
17:45:03.659461 IP6 2001:638:709:a::1 > 2001:638:709:b::1: frag (0|1352) ICMP6, echo request, seq 51, length 1352
17:45:03.659485 IP6 2001:638:709:a::1 > 2001:638:709:b::1: frag (1352|146)
17:45:04.683206 IP6 2001:638:709:a::1 > 2001:638:709:b::1: frag (0|1352) ICMP6, echo request, seq 52, length 1352
17:45:04.683276 IP6 2001:638:709:a::1 > 2001:638:709:b::1: frag (1352|146)
17:45:05.707097 IP6 2001:638:709:a::1 > 2001:638:709:b::1: frag (0|1352) ICMP6, echo request, seq 53, length 1352
17:45:05.707118 IP6 2001:638:709:a::1 > 2001:638:709:b::1: frag (1352|146)
17:45:06.731770 IP6 2001:638:709:a::1 > 2001:638:709:b::1: frag (0|1352) ICMP6, echo request, seq 54, length 1352
17:45:06.731789 IP6 2001:638:709:a::1 > 2001:638:709:b::1: frag (1352|146)
17:45:07.755398 IP6 2001:638:709:a::1 > 2001:638:709:b::1: frag (0|1352) ICMP6, echo request, seq 55, length 1352
17:45:07.755422 IP6 2001:638:709:a::1 > 2001:638:709:b::1: frag (1352|146)
17:45:08.779867 IP6 2001:638:709:a::1 > 2001:638:709:b::1: frag (0|1352) ICMP6, echo request, seq 56, length 1352
17:45:08.779893 IP6 2001:638:709:a::1 > 2001:638:709:b::1: frag (1352|146)
17:45:09.803686 IP6 2001:638:709:a::1 > 2001:638:709:b::1: frag (0|1352) ICMP6, echo request, seq 57, length 1352
17:45:09.803707 IP6 2001:638:709:a::1 > 2001:638:709:b::1: frag (1352|146)
17:45:10.827551 IP6 2001:638:709:a::1 > 2001:638:709:b::1: frag (0|1352) ICMP6, echo request, seq 58, length 1352
17:45:10.827571 IP6 2001:638:709:a::1 > 2001:638:709:b::1: frag (1352|146)
17:45:11.851224 IP6 2001:638:709:a::1 > 2001:638:709:b::1: frag (0|1352) ICMP6, echo request, seq 59, length 1352
17:45:11.851249 IP6 2001:638:709:a::1 > 2001:638:709:b::1: frag (1352|146)
17:45:12.875756 IP6 2001:638:709:a::1 > 2001:638:709:b::1: frag (0|1352) ICMP6, echo request, seq 60, length 1352
17:45:12.875778 IP6 2001:638:709:a::1 > 2001:638:709:b::1: frag (1352|146)
17:45:13.899131 IP6 2001:638:709:a::1 > 2001:638:709:b::1: frag (0|1352) ICMP6, echo request, seq 61, length 1352
17:45:13.899158 IP6 2001:638:709:a::1 > 2001:638:709:b::1: frag (1352|146)
17:45:14.923412 IP6 2001:638:709:a::1 > 2001:638:709:b::1: frag (0|1352) ICMP6, echo request, seq 62, length 1352
17:45:14.923438 IP6 2001:638:709:a::1 > 2001:638:709:b::1: frag (1352|146)
17:45:15.947187 IP6 2001:638:709:a::1 > 2001:638:709:b::1: frag (0|1352) ICMP6, echo request, seq 63, length 1352
17:45:15.947210 IP6 2001:638:709:a::1 > 2001:638:709:b::1: frag (1352|146)
17:45:16.971053 IP6 2001:638:709:a::1 > 2001:638:709:b::1: frag (0|1352) ICMP6, echo request, seq 64, length 1352
17:45:16.971075 IP6 2001:638:709:a::1 > 2001:638:709:b::1: frag (1352|146)
17:45:17.995411 IP6 2001:638:709:a::1 > 2001:638:709:b::1: frag (0|1352) ICMP6, echo request, seq 65, length 1352
17:45:17.995435 IP6 2001:638:709:a::1 > 2001:638:709:b::1: frag (1352|146)
17:45:19.019143 IP6 2001:638:709:a::1 > 2001:638:709:b::1: frag (0|1352) ICMP6, echo request, seq 66, length 1352
17:45:19.019162 IP6 2001:638:709:a::1 > 2001:638:709:b::1: frag (1352|146)
17:45:20.043470 IP6 2001:638:709:a::1 > 2001:638:709:b::1: frag (0|1352) ICMP6, echo request, seq 67, length 1352
17:45:20.043514 IP6 2001:638:709:a::1 > 2001:638:709:b::1: frag (1352|146)
17:45:21.067379 IP6 2001:638:709:a::1 > 2001:638:709:b::1: frag (0|1352) ICMP6, echo request, seq 68, length 1352
17:45:21.067402 IP6 2001:638:709:a::1 > 2001:638:709:b::1: frag (1352|146)
17:45:22.091085 IP6 2001:638:709:a::1 > 2001:638:709:b::1: frag (0|1352) ICMP6, echo request, seq 69, length 1352
17:45:22.091105 IP6 2001:638:709:a::1 > 2001:638:709:b::1: frag (1352|146)
17:45:23.116077 IP6 2001:638:709:a::1 > 2001:638:709:b::1: frag (0|1352) ICMP6, echo request, seq 70, length 1352
17:45:23.116103 IP6 2001:638:709:a::1 > 2001:638:709:b::1: frag (1352|146)
17:45:24.139048 IP6 2001:638:709:a::1 > 2001:638:709:b::1: frag (0|1352) ICMP6, echo request, seq 71, length 1352
17:45:24.139067 IP6 2001:638:709:a::1 > 2001:638:709:b::1: frag (1352|146)
17:45:25.163670 IP6 2001:638:709:a::1 > 2001:638:709:b::1: frag (0|1352) ICMP6, echo request, seq 72, length 1352
17:45:25.163699 IP6 2001:638:709:a::1 > 2001:638:709:b::1: frag (1352|146)
17:45:26.187431 IP6 2001:638:709:a::1 > 2001:638:709:b::1: frag (0|1352) ICMP6, echo request, seq 73, length 1352
17:45:26.187455 IP6 2001:638:709:a::1 > 2001:638:709:b::1: frag (1352|146)
17:45:27.211736 IP6 2001:638:709:a::1 > 2001:638:709:b::1: frag (0|1352) ICMP6, echo request, seq 74, length 1352
17:45:27.211760 IP6 2001:638:709:a::1 > 2001:638:709:b::1: frag (1352|146)
17:45:28.235135 IP6 2001:638:709:a::1 > 2001:638:709:b::1: frag (0|1352) ICMP6, echo request, seq 75, length 1352
17:45:28.235156 IP6 2001:638:709:a::1 > 2001:638:709:b::1: frag (1352|146)
17:45:29.259276 IP6 2001:638:709:a::1 > 2001:638:709:b::1: frag (0|1352) ICMP6, echo request, seq 76, length 1352
17:45:29.259300 IP6 2001:638:709:a::1 > 2001:638:709:b::1: frag (1352|146)
17:45:30.283095 IP6 2001:638:709:a::1 > 2001:638:709:b::1: frag (0|1352) ICMP6, echo request, seq 77, length 1352
17:45:30.283117 IP6 2001:638:709:a::1 > 2001:638:709:b::1: frag (1352|146)
17:45:31.307906 IP6 2001:638:709:a::1 > 2001:638:709:b::1: frag (0|1352) ICMP6, echo request, seq 78, length 1352
17:45:31.307930 IP6 2001:638:709:a::1 > 2001:638:709:b::1: frag (1352|146)
17:45:32.331109 IP6 2001:638:709:a::1 > 2001:638:709:b::1: frag (0|1352) ICMP6, echo request, seq 79, length 1352
17:45:32.331136 IP6 2001:638:709:a::1 > 2001:638:709:b::1: frag (1352|146)
17:45:33.355215 IP6 2001:638:709:a::1 > 2001:638:709:b::1: frag (0|1352) ICMP6, echo request, seq 80, length 1352
17:45:33.355243 IP6 2001:638:709:a::1 > 2001:638:709:b::1: frag (1352|146)
17:45:34.384902 IP6 2001:638:709:a::1 > 2001:638:709:b::1: frag (0|1352) ICMP6, echo request, seq 81, length 1352
17:45:34.384935 IP6 2001:638:709:a::1 > 2001:638:709:b::1: frag (1352|146)
17:45:35.403171 IP6 2001:638:709:a::1 > 2001:638:709:b::1: frag (0|1352) ICMP6, echo request, seq 82, length 1352
17:45:35.403191 IP6 2001:638:709:a::1 > 2001:638:709:b::1: frag (1352|146)
17:45:36.427376 IP6 2001:638:709:a::1 > 2001:638:709:b::1: frag (0|1352) ICMP6, echo request, seq 83, length 1352
17:45:36.427404 IP6 2001:638:709:a::1 > 2001:638:709:b::1: frag (1352|146)
17:45:37.451445 IP6 2001:638:709:a::1 > 2001:638:709:b::1: frag (0|1352) ICMP6, echo request, seq 84, length 1352
17:45:37.451479 IP6 2001:638:709:a::1 > 2001:638:709:b::1: frag (1352|146)
17:45:38.476040 IP6 2001:638:709:a::1 > 2001:638:709:b::1: frag (0|1352) ICMP6, echo request, seq 85, length 1352
17:45:38.476067 IP6 2001:638:709:a::1 > 2001:638:709:b::1: frag (1352|146)
17:45:39.500086 IP6 2001:638:709:a::1 > 2001:638:709:b::1: frag (0|1352) ICMP6, echo request, seq 86, length 1352
17:45:39.500110 IP6 2001:638:709:a::1 > 2001:638:709:b::1: frag (1352|146)
17:45:40.523229 IP6 2001:638:709:a::1 > 2001:638:709:b::1: frag (0|1352) ICMP6, echo request, seq 87, length 1352
17:45:40.523250 IP6 2001:638:709:a::1 > 2001:638:709:b::1: frag (1352|146)
17:45:41.548116 IP6 2001:638:709:a::1 > 2001:638:709:b::1: frag (0|1352) ICMP6, echo request, seq 88, length 1352
17:45:41.548143 IP6 2001:638:709:a::1 > 2001:638:709:b::1: frag (1352|146)
17:45:42.571955 IP6 2001:638:709:a::1 > 2001:638:709:b::1: frag (0|1352) ICMP6, echo request, seq 89, length 1352
17:45:42.571978 IP6 2001:638:709:a::1 > 2001:638:709:b::1: frag (1352|146)
17:45:43.595085 IP6 2001:638:709:a::1 > 2001:638:709:b::1: frag (0|1352) ICMP6, echo request, seq 90, length 1352
17:45:43.595118 IP6 2001:638:709:a::1 > 2001:638:709:b::1: frag (1352|146)
17:45:44.619986 IP6 2001:638:709:a::1 > 2001:638:709:b::1: frag (0|1352) ICMP6, echo request, seq 91, length 1352
17:45:44.620018 IP6 2001:638:709:a::1 > 2001:638:709:b::1: frag (1352|146)
17:45:45.643499 IP6 2001:638:709:a::1 > 2001:638:709:b::1: frag (0|1352) ICMP6, echo request, seq 92, length 1352
17:45:45.643530 IP6 2001:638:709:a::1 > 2001:638:709:b::1: frag (1352|146)
17:45:46.667296 IP6 2001:638:709:a::1 > 2001:638:709:b::1: frag (0|1352) ICMP6, echo request, seq 93, length 1352
17:45:46.667320 IP6 2001:638:709:a::1 > 2001:638:709:b::1: frag (1352|146)
17:45:47.692069 IP6 2001:638:709:a::1 > 2001:638:709:b::1: frag (0|1352) ICMP6, echo request, seq 94, length 1352
17:45:47.692092 IP6 2001:638:709:a::1 > 2001:638:709:b::1: frag (1352|146)
17:45:48.716080 IP6 2001:638:709:a::1 > 2001:638:709:b::1: frag (0|1352) ICMP6, echo request, seq 95, length 1352
17:45:48.716108 IP6 2001:638:709:a::1 > 2001:638:709:b::1: frag (1352|146)
17:45:49.739156 IP6 2001:638:709:a::1 > 2001:638:709:b::1: frag (0|1352) ICMP6, echo request, seq 96, length 1352
17:45:49.739184 IP6 2001:638:709:a::1 > 2001:638:709:b::1: frag (1352|146)
17:45:50.763137 IP6 2001:638:709:a::1 > 2001:638:709:b::1: frag (0|1352) ICMP6, echo request, seq 97, length 1352
17:45:50.763160 IP6 2001:638:709:a::1 > 2001:638:709:b::1: frag (1352|146)
17:45:51.788396 IP6 2001:638:709:a::1 > 2001:638:709:b::1: frag (0|1352) ICMP6, echo request, seq 98, length 1352
17:45:51.788426 IP6 2001:638:709:a::1 > 2001:638:709:b::1: frag (1352|146)
17:45:52.812132 IP6 2001:638:709:a::1 > 2001:638:709:b::1: frag (0|1352) ICMP6, echo request, seq 99, length 1352
17:45:52.812158 IP6 2001:638:709:a::1 > 2001:638:709:b::1: frag (1352|146)
17:45:53.838722 IP6 2001:638:709:a::1 > 2001:638:709:b::1: frag (0|1352) ICMP6, echo request, seq 100, length 1352
17:45:53.838987 IP6 2001:638:709:a::1 > 2001:638:709:b::1: frag (1352|146)
17:47:16.661701 IP6 Ubuntu-sys.mdns > ff02::fb.mdns: 0 [2q] PTR (QM)? _ipps._tcp.local. PTR (QM)? _ipp._tcp.local. (45)
